{
  "$schema": "http://json-schema.org/draft-07/schema#",
  "title": "SAPHIRE Schema",
  "description": "Schema for SAPHIRE PRA data",
  "type": "object",
  "required": ["version", "project"],
  "properties": {
    "version": {
      "type": "string",
      "description": "SAPHIRE schema version"
    },
    "project": {
      "type": "object",
      "required": ["name"],
      "properties": {
        "name": {
          "type": "string",
          "description": "Project name"
        },
        "description": {
          "type": "string",
          "description": "Project description"
        },
        "attributes": {
          "type": "object",
          "description": "Project attributes from FAA file",
          "properties": {
            "mission_time": {
              "type": "number",
              "description": "Mission time in hours"
            },
            "analyst": {
              "type": "string",
              "description": "Analyst name"
            }
          }
        },
        "text": {
          "type": "string",
          "description": "Project text from FAT file"
        }
      }
    },
    "fault_trees": {
      "type": "array",
      "description": "List of fault trees",
      "items": {
        "type": "object",
        "required": ["id", "name", "gates", "basic_events"],
        "properties": {
          "id": {
            "type": "string",
            "description": "Unique identifier for the fault tree"
          },
          "name": {
            "type": "string",
            "description": "Name of the fault tree"
          },
          "description": {
            "type": "string",
            "description": "Description of the fault tree from FTD file"
          },
          "attributes": {
            "type": "object",
            "description": "Fault tree attributes from FTA file",
            "properties": {
              "uncertainty": {
                "type": "object",
                "description": "Uncertainty information"
              }
            }
          },
          "text": {
            "type": "string",
            "description": "Descriptive text from FTT file"
          },
          "gates": {
            "type": "array",
            "description": "List of gates in the fault tree",
            "items": {
              "type": "object",
              "required": ["id", "type", "inputs"],
              "properties": {
                "id": {
                  "type": "string",
                  "description": "Gate identifier"
                },
                "type": {
                  "type": "string",
                  "enum": ["AND", "OR", "NOT", "XOR", "NAND", "NOR"],
                  "description": "Gate type"
                },
                "inputs": {
                  "type": "array",
                  "description": "List of input identifiers (gates or basic events)",
                  "items": {
                    "type": "string"
                  }
                },
                "description": {
                  "type": "string",
                  "description": "Gate description from GTD file"
                }
              }
            }
          },
          "basic_events": {
            "type": "array",
            "description": "List of basic events used in this fault tree",
            "items": {
              "type": "string"
            }
          },
          "post_processing_rules": {
            "type": "array",
            "description": "Post-processing rules from FTY file",
            "items": {
              "type": "string"
            }
          }
        }
      }
    },
    "event_trees": {
      "type": "array",
      "description": "List of event trees",
      "items": {
        "type": "object",
        "required": ["id", "name", "initiating_event", "sequences"],
        "properties": {
          "id": {
            "type": "string",
            "description": "Unique identifier for the event tree"
          },
          "name": {
            "type": "string",
            "description": "Name of the event tree"
          },
          "description": {
            "type": "string",
            "description": "Description of the event tree from ETD file"
          },
          "attributes": {
            "type": "object",
            "description": "Event tree attributes from ETA file",
            "properties": {
              "initiating_event": {
                "type": "string",
                "description": "Initiating event correspondence"
              }
            }
          },
          "text": {
            "type": "string",
            "description": "Descriptive text from ETT file"
          },
          "initiating_event": {
            "type": "string",
            "description": "Initiating event identifier"
          },
          "sequences": {
            "type": "array",
            "description": "List of sequences in the event tree",
            "items": {
              "type": "object",
              "required": ["id", "path", "end_state"],
              "properties": {
                "id": {
                  "type": "string",
                  "description": "Sequence identifier"
                },
                "path": {
                  "type": "array",
                  "description": "Path through the event tree (success/failure for each branch)",
                  "items": {
                    "type": "object",
                    "required": ["event", "state"],
                    "properties": {
                      "event": {
                        "type": "string",
                        "description": "Event identifier"
                      },
                      "state": {
                        "type": "boolean",
                        "description": "True for success, false for failure"
                      }
                    }
                  }
                },
                "end_state": {
                  "type": "string",
                  "description": "End state identifier"
                }
              }
            }
          },
          "rules": {
            "type": "array",
            "description": "Rules from ETR file",
            "items": {
              "type": "string",
              "description": "Rule definition"
            }
          },
          "partition_rules": {
            "type": "array",
            "description": "Partition rules from ETY/ETP file",
            "items": {
              "type": "string",
              "description": "Partition rule definition"
            }
          }
        }
      }
    },
    "sequences": {
      "type": "array",
      "description": "List of accident sequences",
      "items": {
        "type": "object",
        "required": ["id", "name", "end_state"],
        "properties": {
          "id": {
            "type": "string",
            "description": "Sequence identifier"
          },
          "name": {
            "type": "string",
            "description": "Sequence name"
          },
          "description": {
            "type": "string",
            "description": "Description from SQD file"
          },
          "attributes": {
            "type": "object",
            "description": "Sequence attributes from SQA file",
            "properties": {
              "flag_set": {
                "type": "string",
                "description": "Flag set association"
              },
              "end_state": {
                "type": "string",
                "description": "End state assignment"
              },
              "min_cut_sets": {
                "type": "integer",
                "description": "Number of minimal cut sets"
              },
              "mission_time": {
                "type": "number",
                "description": "Mission time for this sequence"
              }
            }
          },
          "end_state": {
            "type": "string",
            "description": "End state identifier"
          },
          "cut_sets": {
            "type": "array",
            "description": "Cut sets from SQC file",
            "items": {
              "type": "array",
              "description": "Minimal cut set",
              "items": {
                "type": "string",
                "description": "Basic event identifier"
              }
            }
          },
          "post_processing_rules": {
            "type": "array",
            "description": "Post-processing rules from SQY file",
            "items": {
              "type": "string",
              "description": "Rule definition"
            }
          },
          "partition_rules": {
            "type": "array",
            "description": "Partition rules from SQP file",
            "items": {
              "type": "string",
              "description": "Partition rule definition"
            }
          }
        }
      }
    },
    "basic_events": {
      "type": "array",
      "description": "List of basic events",
      "items": {
        "type": "object",
        "required": ["id", "name", "probability"],
        "properties": {
          "id": {
            "type": "string",
            "description": "Unique identifier for the basic event"
          },
          "name": {
            "type": "string",
            "description": "Name of the basic event"
          },
          "description": {
            "type": "string",
            "description": "Description of the basic event from BED file"
          },
          "alternate_description": {
            "type": "string",
            "description": "Alternate description from BEDA file"
          },
          "probability": {
            "type": "number",
            "description": "Probability of the basic event from BEI file",
            "minimum": 0,
            "maximum": 1
          },
          "attributes": {
            "type": "object",
            "description": "Basic event attributes from BEA file"
          },
          "transformations": {
            "type": "array",
            "description": "Transformations from BET file",
            "items": {
              "type": "object",
              "properties": {
                "level": {
                  "type": "string",
                  "description": "Transformation level"
                },
                "type": {
                  "type": "string",
                  "enum": ["AND", "OR", "ZOR"],
                  "description": "Transformation type"
                },
                "events": {
                  "type": "array",
                  "description": "Contributing events",
                  "items": {
                    "type": "string"
                  }
                }
              }
            }
          },
          "compound_info": {
            "type": "object",
            "description": "Compound event information from BEC file",
            "properties": {
              "level": {
                "type": "string",
                "description": "Compound level"
              },
              "type": {
                "type": "string",
                "enum": ["AND", "OR", "ZOR"],
                "description": "Compound type"
              },
              "library": {
                "type": "string",
                "description": "Plug-in library name"
              },
              "procedure": {
                "type": "string",
                "description": "Procedure name within library"
              }
            }
          },
          "category": {
            "type": "object",
            "description": "Category information from BECAT file",
            "properties": {
              "name": {
                "type": "string",
                "description": "Category name"
              },
              "level": {
                "type": "string",
                "description": "Category level"
              }
            }
          },
          "grade": {
            "type": "string",
            "description": "Grade from BEG file",
            "enum": ["", "S", "V"]
          },
          "hra_info": {
            "type": "object",
            "description": "Human Reliability Analysis info from BEH file"
          },
          "ccf_info": {
            "type": "object",
            "description": "Common Cause Failure info from BER file"
          }
        }
      }
    },
    "end_states": {
      "type": "array",
      "description": "List of end states",
      "items": {
        "type": "object",
        "required": ["id", "name"],
        "properties": {
          "id": {
            "type": "string",
            "description": "Unique identifier for the end state"
          },
          "name": {
            "type": "string",
            "description": "Name of the end state"
          },
          "description": {
            "type": "string",
            "description": "Description of the end state from ESD file"
          },
          "text": {
            "type": "string",
            "description": "Descriptive text from EST file"
          },
          "cut_sets": {
            "type": "array",
            "description": "Cut sets from ESC file",
            "items": {
              "type": "array",
              "description": "Minimal cut set",
              "items": {
                "type": "string",
                "description": "Basic event identifier"
              }
            }
          },
          "quantification": {
            "type": "object",
            "description": "Quantification info from ESI file",
            "properties": {
              "method": {
                "type": "string",
                "description": "Quantification method"
              },
              "passes": {
                "type": "integer",
                "description": "Number of passes"
              }
            }
          }
        }
      }
    },
    "model_types": {
      "type": "array",
      "description": "Model types from MTD file",
      "items": {
        "type": "object",
        "properties": {
          "id": {
            "type": "string",
            "description": "Model type identifier"
          },
          "description": {
            "type": "string",
            "description": "Model type description"
          }
        }
      }
    },
    "phase_models": {
      "type": "array",
      "description": "Phase models from PHD file",
      "items": {
        "type": "object",
        "properties": {
          "id": {
            "type": "string",
            "description": "Phase model identifier"
          },
          "description": {
            "type": "string",
            "description": "Phase model description"
          }
        }
      }
    },
    "source_files": {
      "type": "object",
      "description": "References to the original SAPHIRE files",
      "properties": {
        "mard_file": {
          "type": "string",
          "description": "Path to the MARD file"
        },
        "project_description": {
          "type": "string",
          "description": "Path to the FAD file"
        },
        "event_tree_logic": {
          "type": "string",
          "description": "Path to the ETL file"
        },
        "fault_tree_logic": {
          "type": "string",
          "description": "Path to the FTL file"
        },
        "basic_event_info": {
          "type": "string",
          "description": "Path to the BEI file"
        }
      }
    }
  }
}