{
  "version": "1.0",
  "project": {
    "name": "HTGR_PRA",
    "description": "High Temperature Gas-cooled Reactor Probabilistic Risk Assessment"
  },
  "fault_trees": [
    {
      "id": "G1-ADS",
      "name": "Automatic Depressurization System Fault Tree",
      "gates": [
        {
          "id": "TOP-G1",
          "type": "OR",
          "inputs": ["G1-1", "BE1"]
        },
        {
          "id": "G1-1",
          "type": "AND",
          "inputs": ["BE2", "BE3"]
        }
      ],
      "basic_events": ["BE1", "BE2", "BE3"]
    }
  ],
  "event_trees": [
    {
      "id": "HTGR-ET1",
      "name": "HTGR Main Event Tree",
      "initiating_event": "IE-LOSP",
      "sequences": [
        {
          "id": "SEQ1",
          "path": [
            {
              "event": "RPS",
              "state": true
            },
            {
              "event": "ADS",
              "state": true
            }
          ],
          "end_state": "OK"
        },
        {
          "id": "SEQ2",
          "path": [
            {
              "event": "RPS",
              "state": true
            },
            {
              "event": "ADS",
              "state": false
            }
          ],
          "end_state": "CD"
        },
        {
          "id": "SEQ3",
          "path": [
            {
              "event": "RPS",
              "state": false
            }
          ],
          "end_state": "CD"
        }
      ]
    }
  ],
  "basic_events": [
    {
      "id": "BE1",
      "name": "Component A Fails",
      "probability": 0.01,
      "description": "Failure of Component A in the ADS system"
    },
    {
      "id": "BE2",
      "name": "Component B Fails",
      "probability": 0.02,
      "description": "Failure of Component B in the ADS system"
    },
    {
      "id": "BE3",
      "name": "Component C Fails",
      "probability": 0.03,
      "description": "Failure of Component C in the ADS system"
    },
    {
      "id": "IE-LOSP",
      "name": "Loss of Offsite Power",
      "probability": 1.0E-5,
      "description": "Initiating event - Loss of Offsite Power"
    }
  ],
  "end_states": [
    {
      "id": "OK",
      "name": "Success",
      "description": "Plant reaches a safe and stable condition"
    },
    {
      "id": "CD",
      "name": "Core Damage",
      "description": "Core damage occurs"
    }
  ],
  "source_files": {
    "mard_file": "Mard/HTGR_PRA.MARD",
    "event_tree_logic": "Mard/HTGR_PRA_Subs/HTGR_PRA.ETL"
  }
} 